{"$id":"https://capht.tech/schemas/reviewgraphen/benchmark/trial-manifest.v1","$schema":"https://json-schema.org/draft/2020-12/schema","additionalProperties":false,"allOf":[{"else":{"properties":{"expected_packet_ids":{"minItems":1}}},"if":{"properties":{"arm":{"const":"b1_free_form"}},"required":["arm"]},"then":{"properties":{"expected_packet_ids":{"maxItems":0}}}}],"properties":{"arm":{"enum":["b1_free_form","g3_proxy","full_review_graphen"]},"execution":{"additionalProperties":false,"properties":{"budget":{"additionalProperties":false,"properties":{"session_limit":{"maxLength":4096,"minLength":1,"type":["string","null"]},"wall_clock_seconds":{"minimum":1,"type":["integer","null"]}},"required":["wall_clock_seconds","session_limit"],"type":"object"},"inference_settings":{"additionalProperties":{"maxLength":4096,"minLength":1,"type":"string"},"maxProperties":64,"propertyNames":{"maxLength":4096,"minLength":1,"type":"string"},"type":"object"},"model":{"maxLength":4096,"minLength":1,"type":"string"},"model_revision":{"maxLength":4096,"minLength":1,"type":"string"},"prompt_template_version":{"maxLength":4096,"minLength":1,"type":"string"},"provider":{"maxLength":4096,"minLength":1,"type":"string"},"reasoning_effort":{"maxLength":4096,"minLength":1,"type":"string"},"runner_version":{"maxLength":4096,"minLength":1,"type":"string"},"tool_policy_version":{"maxLength":4096,"minLength":1,"type":"string"}},"required":["provider","model","model_revision","reasoning_effort","prompt_template_version","tool_policy_version","runner_version","inference_settings","budget"],"type":"object"},"expected_packet_ids":{"items":{"maxLength":4096,"minLength":1,"type":"string"},"maxItems":4096,"type":"array","uniqueItems":true},"input_tree_hash":{"pattern":"^git:[0-9a-f]{40}$","type":"string"},"limitations":{"items":{"maxLength":4096,"minLength":1,"type":"string"},"maxItems":64,"type":"array","uniqueItems":true},"mechanism_ontology_version":{"const":"reviewgraphen.benchmark.mechanism_ontology.v1"},"packet_hashes":{"items":{"pattern":"^sha256:[0-9a-f]{64}$","type":"string"},"maxItems":4096,"type":"array","uniqueItems":true},"paired_configuration_hash":{"pattern":"^sha256:[0-9a-f]{64}$","type":"string"},"protocol_version":{"const":"reviewgraphen.benchmark.protocol.v2"},"replicate":{"minimum":1,"type":"integer"},"schema":{"const":"reviewgraphen.benchmark.trial_manifest.v1"},"source_bundle_hash":{"pattern":"^sha256:[0-9a-f]{64}$","type":"string"},"source_inventory":{"items":{"additionalProperties":false,"properties":{"content_hash":{"pattern":"^sha256:[0-9a-f]{64}$","type":"string"},"line_count":{"maximum":1000000,"minimum":1,"type":"integer"},"path":{"maxLength":4096,"minLength":1,"pattern":"^(?!/)(?!.*(?:^|/)\\.\\.?/)(?!.*//).+$","type":"string"}},"required":["path","content_hash","line_count"],"type":"object"},"maxItems":4096,"minItems":1,"type":"array"},"trial_id":{"maxLength":4096,"minLength":1,"type":"string"},"unit_id":{"maxLength":4096,"minLength":1,"type":"string"}},"required":["schema","trial_id","unit_id","arm","replicate","input_tree_hash","packet_hashes","expected_packet_ids","source_inventory","source_bundle_hash","protocol_version","mechanism_ontology_version","paired_configuration_hash","limitations","execution"],"type":"object"}
