{"arm":"g3_proxy","execution":{"budget":{"session_limit":"one isolated session per trial","wall_clock_seconds":null},"inference_settings":{"temperature":"unknown"},"model":"gpt-5.6-sol","model_revision":"unknown","prompt_template_version":"m7-real-prompt.v1","provider":"openai","reasoning_effort":"high","runner_version":"codex-subagent.v1","tool_policy_version":"m7-real-isolated-readonly.v1"},"expected_packet_ids":["benchmark-context:sha256:19130d7977a4fc6ca8a8e2b7805897c3b5a6b76194ff2aa6a80ecaaf661ee246","benchmark-context:sha256:882dd25b3d7b55201b854435213ef651e59837252a55d5acb493939fb85f2a76","benchmark-context:sha256:9c2803f69b1f8ef9029bc2ec1f56bfd3782cbe78fc1b0f279fe4de3bdf21bbc8","benchmark-context:sha256:a6fef90268603dfce74788cb28494bc3d239d208c8309d5a924b403826f9a69d","benchmark-context:sha256:d1c83c79d3f153c47b59b835e78cf08f0bff3952e5c4f3b43606c42a2d12a38c"],"input_tree_hash":"git:9768fa637a94fae97360ecd4a699d0909955aad2","limitations":["line_preserving_blind_metadata_and_test_redaction","non_authority_benchmark_packet"],"mechanism_ontology_version":"reviewgraphen.benchmark.mechanism_ontology.v1","packet_hashes":["sha256:28800d17f7af165b4014b960d76b23fb4db92b40c19019f295e22e28f60bbd6f","sha256:3d67d891b52e35537f2900b92551c1f76ff4cf811c6985ee01de365096b5cd7c","sha256:3f32ead66ef8d7d638169a4f12c763f522d29d26976eb56e31305c1b2c097aa2","sha256:4cdd53ba593cc58f5eb3deb57671cf121348ce83c146b08fcbb3b9f3e32595b7","sha256:51f15e39ce266dae3124e4b7414df7a706b7f76b543d238b0d80960f1738d9e0","sha256:603e7add39b159f32e9351ce3c399ecf5fb5cf253101b77810d32f0ad9aebb4f","sha256:7f79f39e74fc9e50151fb9a8c2895c6c19a0ebd5ac64295112e9e1a2073a820a","sha256:84756b26da6271c1e79ba68408b24869fc421ed80aaffff4f90160131fe635df","sha256:977e712f248dc0ddd8f1a8ec6fa1727e2132abb3f50d36d5c3e5561f8dee48e1","sha256:b5874bf828ee0b2cbb94b0d1adc79a2ae2f6ef9e4bab05bd84fbc0cc7bcc8ab0","sha256:bfb73c7a93785c12e28da5902f1c642689448a713f96ead6297eaedbe903d64d","sha256:db37d7be8510ce882cb2ca119e3bde1b0a61a4d7bae9a4fd3bd8f47183e58d6f","sha256:e295f2d92c81677a81a811d81d8e207934baea0db6d01fd8ce0eeea40e5c1456"],"paired_configuration_hash":"sha256:e15aa4182607b43d3f85b479f3a7a3146b656de0acdb90525affe8054afb0757","protocol_version":"reviewgraphen.benchmark.protocol.v2","replicate":1,"schema":"reviewgraphen.benchmark.trial_manifest.v1","source_bundle_hash":"sha256:069ce2658e0dd40ccb4637ffa0f35af08688468350aa9bf467e60d7b18575a3e","source_inventory":[{"content_hash":"sha256:db37d7be8510ce882cb2ca119e3bde1b0a61a4d7bae9a4fd3bd8f47183e58d6f","line_count":472,"path":"rust/fslc/src/lib.rs"},{"content_hash":"sha256:977e712f248dc0ddd8f1a8ec6fa1727e2132abb3f50d36d5c3e5561f8dee48e1","line_count":15905,"path":"rust/fslc/src/main.rs"},{"content_hash":"sha256:b5874bf828ee0b2cbb94b0d1adc79a2ae2f6ef9e4bab05bd84fbc0cc7bcc8ab0","line_count":2549,"path":"rust/fslc/src/verification.rs"}],"trial_id":"m7-real:snapshot-17:g3_proxy:1","unit_id":"snapshot-17"}