{"arm":"full_review_graphen","execution":{"budget":{"session_limit":"one isolated session per trial","wall_clock_seconds":null},"inference_settings":{"temperature":"unknown"},"model":"gpt-5.6-sol","model_revision":"unknown","prompt_template_version":"m7-real-prompt.v1","provider":"openai","reasoning_effort":"high","runner_version":"codex-subagent.v1","tool_policy_version":"m7-real-isolated-readonly.v1"},"expected_packet_ids":["context-envelope:sha256:3cdc546311665e335505fd98592307c033fbfd93d974baa37416e93fc5e3fb5d","context-envelope:sha256:474e02d5956b91dd9f4d44553dbada861e05f99a4a160644269e52fbc0fb6087","context-envelope:sha256:845dd4b1ad7dc4cafbc00da89be248fa086ec4b48f632793a7f45583e7883427","context-envelope:sha256:ad034e3dc789fdc1f52875c76614a7ab8fe1f5d8b05b98b491030b1b292daee2","context-envelope:sha256:bcb06dcd5e8aaac253160831764d844056391267e22729dabaaedcf21745686e"],"input_tree_hash":"git:6da767730c9fe0b6de04db107b2acb6ebcecd96f","limitations":["canonical_context_envelopes_are_reviewer_input","live_model_output_is_non_authority"],"mechanism_ontology_version":"reviewgraphen.benchmark.mechanism_ontology.v1","packet_hashes":["sha256:2670847597f6eb1733e3065199ff624b3766b59bdd40e7a72fda18858d521a87","sha256:2aa8b4b2b18bf5647d573f202c0640336f8c3cae79b03ee40ccb902894551509","sha256:348014245b489960f18172cdaf8d7a8a03d499fdc8c0616526c74f9464166908","sha256:3b30dc2b336327783fc6afa26d80107a337de5ff38922dfdef007da61a887929","sha256:3df6b5270048166160b6f23fb148984350f2611cac211e3136ced2993e39267a","sha256:4f53cda18c2baa0c0354bb5f9a3ecbe5ed12ab4d8e11ba873c2f11161202b945","sha256:5363e88d3085f3e815b916f914767e3e4491e9101140b89d6a3ec25e7e168b77","sha256:66d6ce89086937be1db4aeb8fd0072b9959149787541e4b22645dfa2537a6b29","sha256:7f79f39e74fc9e50151fb9a8c2895c6c19a0ebd5ac64295112e9e1a2073a820a","sha256:84756b26da6271c1e79ba68408b24869fc421ed80aaffff4f90160131fe635df","sha256:8bc6daa79da6699efefeb4ca949520eb158266f3b7a9068b3c0b5b1643a993e0","sha256:abb3eedd54d8fd994195f8d08d771eb5c93f92a8206eae87546353be74d4b868","sha256:ac54c3374682aa7246491ba8e1179fd933a86953489ac923000c30e9f791ef96","sha256:aced5aff8c1ccd5fa8e8f331ad17dcb09c6ef86abfcdd4582e36d17a35ea06fb","sha256:b4af7ddc9645a909844304045e4de6b6b9ede9296c0553290c19b746326ef82e","sha256:f9626849c7390482b19109cdb7fc3ee378d0b5fd73940adfb166f57c1c26c7ba"],"paired_configuration_hash":"sha256:511a6282a119cb3add644f97d3281f3863e6d3c6a1a1d246cc129cc8d870e6f7","protocol_version":"reviewgraphen.benchmark.protocol.v2","replicate":1,"schema":"reviewgraphen.benchmark.trial_manifest.v1","source_bundle_hash":"sha256:736bdadcc1b6e63508cf08302d3470c84e28d41208b55e963edacc83ae9e2444","source_inventory":[{"content_hash":"sha256:0093b88c7f7e6932f91644470a5a0660c5ab33d1cab9f2ad4bd51cad7bdc7169","line_count":16054,"path":"rust/fslc/src/main.rs"}],"trial_id":"m7-real:snapshot-14:full_review_graphen:1","unit_id":"snapshot-14"}