{"arm":"full_review_graphen","execution":{"budget":{"session_limit":"one isolated session per trial","wall_clock_seconds":null},"inference_settings":{"temperature":"unknown"},"model":"gpt-5.6-sol","model_revision":"unknown","prompt_template_version":"m7-real-prompt.v1","provider":"openai","reasoning_effort":"high","runner_version":"codex-subagent.v1","tool_policy_version":"m7-real-isolated-readonly.v1"},"expected_packet_ids":["context-envelope:sha256:5d648c0c4c1450b5a52fe8a391780ba0f1e0b6115a8f54b279a897faf74efa99","context-envelope:sha256:715cf0ca0e59f5cb9ca5281e0b4ce978a435a63b3e806d7c43540a081e0d42ec","context-envelope:sha256:931f3ba29b6941842d8ce0dde7977534a8d18f63e30dbbd96249d5f771971973","context-envelope:sha256:ca264117c529d13d74bad07f1fb64ab9722063fa78a2b7bb3d1795a59cd3eaa3","context-envelope:sha256:ec6e83fa9fa8c5596910fc64ed4326bfd52d2ac962f701089d22a295122ea92d"],"input_tree_hash":"git:24a83bd359181d41c79093ec7648757cb0c4e57a","limitations":["canonical_context_envelopes_are_reviewer_input","live_model_output_is_non_authority"],"mechanism_ontology_version":"reviewgraphen.benchmark.mechanism_ontology.v1","packet_hashes":["sha256:3217d4bc537b3f88c76041fe6e746a071eecfdbcf5717d67d1d9c6f6c8a7f5e3","sha256:3df6b5270048166160b6f23fb148984350f2611cac211e3136ced2993e39267a","sha256:46acb68c6dc3e3d9a8d6acd2e8b3090b67adb4b50ecaa659c59d34b5e595cfba","sha256:4f53cda18c2baa0c0354bb5f9a3ecbe5ed12ab4d8e11ba873c2f11161202b945","sha256:6069cace04b7ddc0c25a6b6d9b281868479cd85b64915f55d082aaa1325efa39","sha256:62a8f0ec52962cff276b4c598b2c337634578578112ddeeb7858c5419d32a981","sha256:64394731ad246750580b74103bbf7616c0ff032f1d5832d8a396e928a025a90e","sha256:753b0c26082c8020cdf91dd752a853df1ea8f5f37ea6ef2d2bda073bbce62203","sha256:7f79f39e74fc9e50151fb9a8c2895c6c19a0ebd5ac64295112e9e1a2073a820a","sha256:80e9cef04c815c99b07c2033e2ac23fe8d899e9b695f1efc627cf4640037069e","sha256:84756b26da6271c1e79ba68408b24869fc421ed80aaffff4f90160131fe635df","sha256:8e549d9b752d858e03da95a93d267fc6f6e4489641ee8256af18ea95d35fe4ee","sha256:9c9de6bfa3bda1f3cddd778a621361d41b303e947568f3fb191e2943deeabc83","sha256:a87736054737b077cc7bc405f33049fece3e64646c0a1b265628b6f340f3abb1","sha256:b0bb59407ffe648a90af40e9f7fa1306bcca981de8d477fec13b47300f1c9e05","sha256:b3e33890895e4bdbd3a02c780e3efe1bb83834c2441cde0a277aa0a3f2d6aff3","sha256:c103c3125fd7d71956932ab72f09488975b2354e0d3c4aa96bc6d6e149c15dfc","sha256:c421a116ecd6cb81be0c3af01ab6a0671e7f233512064e47b5d69648cb1fdccc","sha256:e1319a41118b8ac4c3b9b79ea162b77bea267ad5a5577c52b770f2c62cd99a6a","sha256:ed55cccc01d821805c7f05248d8e137fee3fd24da35f5ccdfc7d1914d9fe6f13"],"paired_configuration_hash":"sha256:eaa5c4686b5e4b37d11a614cfc078bf46f4160cc83b7ea5c99f18c528b371723","protocol_version":"reviewgraphen.benchmark.protocol.v2","replicate":1,"schema":"reviewgraphen.benchmark.trial_manifest.v1","source_bundle_hash":"sha256:3412be08f66f5614633cf5f2d04512cbc201b5deadc1b2d0e4545b824890a054","source_inventory":[{"content_hash":"sha256:828c04d1ace7e7b1b40c4b3ba3d860058ac224ab3644e4f049659d82e38acd31","line_count":948,"path":"rust/fsl-runtime/src/explicit.rs"},{"content_hash":"sha256:b3606bd0c79547bed2b515c61306f7c2493ab9369204e94554e189770f243ebd","line_count":3156,"path":"rust/fsl-runtime/src/lib.rs"},{"content_hash":"sha256:ac68353c2fba194a68626573168551fd8f393a9b2f95cd1a08f70d47bd309ed7","line_count":870,"path":"rust/fsl-wasm/src/lib.rs"},{"content_hash":"sha256:91fa76c5f5890dab90087e472dcef3c2999a8ea75499df65dd0b4fce9b8a1057","line_count":15561,"path":"rust/fslc/src/main.rs"},{"content_hash":"sha256:54252718778abfaef838f1db3267ab94e239bd3392a6b66ba9f80334f5486512","line_count":2515,"path":"rust/fslc/src/verification.rs"}],"trial_id":"m7-real:snapshot-34:full_review_graphen:1","unit_id":"snapshot-34"}