{"arm":"g3_proxy","execution":{"budget":{"session_limit":"one isolated session per trial","wall_clock_seconds":null},"inference_settings":{"temperature":"unknown"},"model":"gpt-5.6-sol","model_revision":"unknown","prompt_template_version":"m7-real-prompt.v1","provider":"openai","reasoning_effort":"high","runner_version":"codex-subagent.v1","tool_policy_version":"m7-real-isolated-readonly.v1"},"expected_packet_ids":["benchmark-context:sha256:9118b59e343b4552454f786fdc42b273ccfd803fb529dffaf1324a9f9021a8f7","benchmark-context:sha256:9c7780c83c6ed691fe1ca43a640459841606f69773053679b4de72934a21fcc7","benchmark-context:sha256:9d2945a7b3088615f40e8ff06d0eb3fc054ea737161fa4d7111bb105746e9f9a","benchmark-context:sha256:b4954cd118e791a5c20dbe27405ee0bf9d89588131e968484718327bc7ec10d4","benchmark-context:sha256:fd08ac780875bab7a23c54a88e832ded8dc7382917f7f84d4f667e68161d6dc8"],"input_tree_hash":"git:8bd8004ad2af61397b558943b67d67c0654b3f9d","limitations":["line_preserving_blind_metadata_and_test_redaction","non_authority_benchmark_packet"],"mechanism_ontology_version":"reviewgraphen.benchmark.mechanism_ontology.v1","packet_hashes":["sha256:070c09c6d94ad1555b2316b19abc8439c649ebe782db28547ddb214b614d07ab","sha256:11adf2342f52d997110892963ecfe6322440312cf2e318ad393523dc3e137317","sha256:1fcdfbd934d469176a38bf758a9637cced4835aeadc5d952fb70fae050353e95","sha256:356c2a6530a430227a3b93cc8b9b911fb3d9fd23e13f2f860a08451a8910a496","sha256:3d67d891b52e35537f2900b92551c1f76ff4cf811c6985ee01de365096b5cd7c","sha256:7e3aa119dfd5a896845ec89e1a3944df82a8391060581caaa31ce93398d7d386","sha256:7f79f39e74fc9e50151fb9a8c2895c6c19a0ebd5ac64295112e9e1a2073a820a","sha256:84756b26da6271c1e79ba68408b24869fc421ed80aaffff4f90160131fe635df","sha256:8b920e429ef274d02baa952544a604430fd7872fbeb39261e4a2548683ea7e8f","sha256:8c56b43af285e73889cf5f142b821c8dcdf3efaa3330eb7c1d6ac8d4ef17e91d","sha256:905ccdfac3bd635ded75334f19305cb9d01f9988518adfe49551b6f928fb7b25","sha256:913413888bc29601956edbb13104d9ba92491c4f705dee8f639aef3eb6f835b0","sha256:a8d88db091cf0a74e0fb4ecbef52ca1aaf2baa6e49fc6aeaba97ca12aa970a71"],"paired_configuration_hash":"sha256:e55289fd21cfe2d4f4204e18a570bb254c10552f28a2ab69c51471c3d9b2f849","protocol_version":"reviewgraphen.benchmark.protocol.v2","replicate":1,"schema":"reviewgraphen.benchmark.trial_manifest.v1","source_bundle_hash":"sha256:e193acccf8b8ed50827c33f0ace1a94a2bf41c091d9219698350b01cc92e8efc","source_inventory":[{"content_hash":"sha256:913413888bc29601956edbb13104d9ba92491c4f705dee8f639aef3eb6f835b0","line_count":1016,"path":"rust/fsl-syntax/src/ai_project.rs"},{"content_hash":"sha256:a8d88db091cf0a74e0fb4ecbef52ca1aaf2baa6e49fc6aeaba97ca12aa970a71","line_count":300,"path":"rust/fslc/src/frontend_output.rs"},{"content_hash":"sha256:8c56b43af285e73889cf5f142b821c8dcdf3efaa3330eb7c1d6ac8d4ef17e91d","line_count":15944,"path":"rust/fslc/src/main.rs"}],"trial_id":"m7-real:snapshot-25:g3_proxy:1","unit_id":"snapshot-25"}