{"arm":"b1_free_form","execution":{"budget":{"session_limit":"one isolated session per trial","wall_clock_seconds":null},"inference_settings":{"temperature":"unknown"},"model":"gpt-5.6-sol","model_revision":"unknown","prompt_template_version":"m7-real-prompt.v1","provider":"openai","reasoning_effort":"high","runner_version":"codex-subagent.v1","tool_policy_version":"m7-real-isolated-readonly.v1"},"expected_packet_ids":[],"input_tree_hash":"git:f953fb15703ac2a2833b00f8801f22655e27a31f","limitations":["line_preserving_blind_metadata_and_test_redaction"],"mechanism_ontology_version":"reviewgraphen.benchmark.mechanism_ontology.v1","packet_hashes":["sha256:7a851bacf1af1aa49fd73641aa8561754850b52048fa2a7c9ab08105d410ceb9","sha256:7f79f39e74fc9e50151fb9a8c2895c6c19a0ebd5ac64295112e9e1a2073a820a","sha256:84756b26da6271c1e79ba68408b24869fc421ed80aaffff4f90160131fe635df","sha256:a1fd423a815a5d85d8f8e450091111bf87033ebd2d462f7144dacbe3a01a771b"],"paired_configuration_hash":"sha256:d0937a3af50b509eac9fc8952bdc7bb062350150e8113100f633eef5c84190a4","protocol_version":"reviewgraphen.benchmark.protocol.v2","replicate":1,"schema":"reviewgraphen.benchmark.trial_manifest.v1","source_bundle_hash":"sha256:a8eb14b09c2872d6a0a8a66ce26e441c5d138554ac9199275aeec6515bae53d5","source_inventory":[{"content_hash":"sha256:a1fd423a815a5d85d8f8e450091111bf87033ebd2d462f7144dacbe3a01a771b","line_count":3181,"path":"rust/fsl-runtime/src/lib.rs"}],"trial_id":"m7-real:snapshot-32:b1:1","unit_id":"snapshot-32"}